{
  "schema_version": 1,
  "id": "BLUEPRINT-PROPOSAL-example",
  "status": "review_required",
  "project": "example-project",
  "source_blueprints": [
    {
      "id": "security-core",
      "version": "security-core-1.0.0",
      "path": "data/blueprints/security-core/asvs-5.0.0/fr-catalog.blueprint.json",
      "sha256": "sha256:blueprint"
    }
  ],
  "source_mapping_packs": [
    {
      "id": "security-core-blueprint-to-asvs-5.0.0",
      "version": "1.0.0",
      "path": "data/blueprint-mappings/security-core/asvs/5.0.0.json",
      "sha256": "sha256:mapping-pack",
      "blueprint": {
        "catalog": "security-core",
        "version": "security-core-1.0.0"
      },
      "compliance": {
        "ruleset": "ASVS",
        "version": "5.0.0"
      }
    }
  ],
  "candidates": [
    {
      "id": "CANDIDATE-session-timeout",
      "blueprint_fr": "FR-BP-SEC-SESSION-MANAGEMENT-001",
      "blueprint_tbts": ["TBT-BP-SEC-SESSION-MANAGEMENT-001-A"],
      "decision": "pending_review",
      "rationale": "Authenticated sessions are in scope.",
      "confidence": "high",
      "assumptions": [],
      "compliance_mappings": [
        {
          "ruleset": "ASVS",
          "version": "5.0.0",
          "relationship": "satisfies",
          "traceability_strength": "direct",
          "mapping_ids": ["BCM-ASVS-5-FR-SESSION-MANAGEMENT-001"],
          "rows": [
            {"ruleset": "ASVS", "row": "v5.0.0-7.1.1"},
            {"ruleset": "ASVS", "row": "v5.0.0-7.2.1"}
          ],
          "domains": []
        }
      ]
    }
  ],
  "content_hash": "sha256:blueprint-proposal-example"
}
